{
  "id": "sample-turkish",
  "title": "Turkish (teaching sample)",
  "language": {
    "name": "Turkish",
    "tag": "tr"
  },
  "teaches": [
    "suffix slots in order",
    "vowel harmony",
    "parsing speed"
  ],
  "summary": "A small Turkish teaching grammar for exploring suffix order, vowel harmony, and parser work.",
  "disclaimer": "A simplified teaching grammar for learning Motif; not a description of Turkish.",
  "description": "A simplified teaching grammar for learning Motif; not a description of Turkish.",
  "phonemes": ["a", "b", "c", "e", "g", "i", "k", "l", "m", "n", "o", "p", "r", "s", "t", "u", "v", "y", "ı", "ü"],
  "partsOfSpeech": [
    { "id": "noun", "name": "Noun" }
  ],
  "stems": [
    { "id": "ev", "form": "ev", "partOfSpeech": "noun", "gloss": "house" },
    { "id": "su", "form": "su", "partOfSpeech": "noun", "gloss": "water" },
    { "id": "okul", "form": "okul", "partOfSpeech": "noun", "gloss": "school" },
    { "id": "kitap", "form": "kitap", "partOfSpeech": "noun", "gloss": "book" },
    { "id": "masa", "form": "masa", "partOfSpeech": "noun", "gloss": "table" },
    { "id": "kapi", "form": "kapı", "partOfSpeech": "noun", "gloss": "door" },
    { "id": "araba", "form": "araba", "partOfSpeech": "noun", "gloss": "car" },
    { "id": "yol", "form": "yol", "partOfSpeech": "noun", "gloss": "road" },
    { "id": "gun", "form": "gün", "partOfSpeech": "noun", "gloss": "day" },
    { "id": "gece", "form": "gece", "partOfSpeech": "noun", "gloss": "night" }
  ],
  "texts": [
    {
      "id": "ten-nouns",
      "title": "Ten nouns",
      "sentences": ["ev su okul kitap masa kapı araba yol gün gece"]
    }
  ]
}
